============================== Prover9 ===============================
Prover9 (64) version 2017-11A (CIIRC), November 2017.
Process 59212 was started by dani on Ubuntu,
Tue Dec 30 00:25:53 2025
The command was "src/backend/prover9/Prover9/LADR-2009-11A/bin/prover9 -f src/backend/fol_inputs/prover9_2025-12-30T00-25-53_9a1f2ead.in".
============================== end of head ===========================

============================== INPUT =================================

% Reading from file src/backend/fol_inputs/prover9_2025-12-30T00-25-53_9a1f2ead.in

set(production).
    % set(production) -> set(raw).
    % set(raw) -> clear(auto).
    % clear(auto) -> clear(auto_inference).
    % clear(auto) -> clear(auto_setup).
    % clear(auto_setup) -> clear(predicate_elim).
    % clear(auto_setup) -> assign(eq_defs, pass).
    % clear(auto) -> clear(auto_limits).
    % clear(auto_limits) -> assign(max_weight, "1000000000000.000").
    % clear(auto_limits) -> assign(sos_limit, -1).
    % clear(auto) -> clear(auto_denials).
    % clear(auto) -> clear(auto_process).
    % set(raw) -> clear(ordered_res).
    % set(raw) -> clear(ordered_para).
    % set(raw) -> set(para_into_vars).
    % set(raw) -> set(para_from_small).
    % set(raw) -> clear(ordered_para).
    % set(raw) -> clear(back_demod).
    % set(raw) -> clear(cac_redundancy).
    % set(raw) -> assign(backsub_check, 2147483647).
    % set(raw) -> set(lightest_first).
    % set(lightest_first) -> assign(weight_part, 1).
    % set(lightest_first) -> assign(age_part, 0).
    % set(lightest_first) -> assign(false_part, 0).
    % set(lightest_first) -> assign(true_part, 0).
    % set(lightest_first) -> assign(random_part, 0).
    % set(raw) -> assign(literal_selection, none).
    % set(production) -> set(eval_rewrite).
    % set(production) -> set(hyper_resolution).
    % set(hyper_resolution) -> set(pos_hyper_resolution).
    % set(production) -> clear(back_subsume).

formulas(assumptions).
assign(max_weight,11).
assign(max_proofs,1).
assign(max_seconds,11).
assign(sos_limit,23).
connected(22,15,r90).
connected(15,16,r90).
connected(16,17,r90).
connected(17,18,r90).
connected(18,20,r20).
connected(20,14,r20).
connected(14,19,r20).
connected(19,21,r20).
connected(21,12,r20).
connected(12,13,r20).
succ(0,1).
succ(1,2).
succ(2,3).
succ(3,4).
succ(4,5).
succ(5,6).
succ(6,7).
succ(7,8).
succ(8,9).
succ(9,10).
step(0,22).
uses(1,r90).
uses(2,r90).
uses(3,r90).
uses(4,r90).
uses(5,r20).
uses(6,r20).
uses(7,r20).
uses(8,r20).
uses(9,r20).
uses(10,r20).
(all N all M all X all Y all R (step(N,X) & succ(N,M) & uses(M,R) & connected(X,Y,R) -> step(M,Y))).
end_of_list.

formulas(goals).
step(10,13).
end_of_list.

============================== end of input ==========================

============================== PROCESS NON-CLAUSAL FORMULAS ==========

% Formulas that are not ordinary clauses:
1 (all N all M all X all Y all R (step(N,X) & succ(N,M) & uses(M,R) & connected(X,Y,R) -> step(M,Y))) # label(non_clause).  [assumption].
2 step(10,13) # label(non_clause) # label(goal).  [goal].

============================== end of process non-clausal formulas ===

============================== PROCESS INITIAL CLAUSES ===============

% Clauses before input processing:

formulas(usable).
end_of_list.

formulas(sos).
assign(max_weight,11).  [assumption].
assign(max_proofs,1).  [assumption].
assign(max_seconds,11).  [assumption].
assign(sos_limit,23).  [assumption].
connected(22,15,r90).  [assumption].
connected(15,16,r90).  [assumption].
connected(16,17,r90).  [assumption].
connected(17,18,r90).  [assumption].
connected(18,20,r20).  [assumption].
connected(20,14,r20).  [assumption].
connected(14,19,r20).  [assumption].
connected(19,21,r20).  [assumption].
connected(21,12,r20).  [assumption].
connected(12,13,r20).  [assumption].
succ(0,1).  [assumption].
succ(1,2).  [assumption].
succ(2,3).  [assumption].
succ(3,4).  [assumption].
succ(4,5).  [assumption].
succ(5,6).  [assumption].
succ(6,7).  [assumption].
succ(7,8).  [assumption].
succ(8,9).  [assumption].
succ(9,10).  [assumption].
step(0,22).  [assumption].
uses(1,r90).  [assumption].
uses(2,r90).  [assumption].
uses(3,r90).  [assumption].
uses(4,r90).  [assumption].
uses(5,r20).  [assumption].
uses(6,r20).  [assumption].
uses(7,r20).  [assumption].
uses(8,r20).  [assumption].
uses(9,r20).  [assumption].
uses(10,r20).  [assumption].
-step(x,y) | -succ(x,z) | -uses(z,u) | -connected(y,w,u) | step(z,w).  [clausify(1)].
-step(10,13).  [deny(2)].
end_of_list.

formulas(demodulators).
end_of_list.

Term ordering decisions:
Predicate symbol precedence:  predicate_order([ succ, uses, assign, step, connected ]).
Function symbol precedence:  function_order([ r20, r90, 1, 2, 3, 4, 5, 6, 7, 8, 9, 0, 10, 11, 12, 14, 15, 16, 17, 18, 19, 20, 21, 22, 13, 23, max_proofs, max_seconds, max_weight, sos_limit ]).
After inverse_order:  (no changes).

kept:      3 assign(max_weight,11).  [assumption].
kept:      4 assign(max_proofs,1).  [assumption].
kept:      5 assign(max_seconds,11).  [assumption].
kept:      6 assign(sos_limit,23).  [assumption].
kept:      7 connected(22,15,r90).  [assumption].
kept:      8 connected(15,16,r90).  [assumption].
kept:      9 connected(16,17,r90).  [assumption].
kept:      10 connected(17,18,r90).  [assumption].
kept:      11 connected(18,20,r20).  [assumption].
kept:      12 connected(20,14,r20).  [assumption].
kept:      13 connected(14,19,r20).  [assumption].
kept:      14 connected(19,21,r20).  [assumption].
kept:      15 connected(21,12,r20).  [assumption].
kept:      16 connected(12,13,r20).  [assumption].
kept:      17 succ(0,1).  [assumption].
kept:      18 succ(1,2).  [assumption].
kept:      19 succ(2,3).  [assumption].
kept:      20 succ(3,4).  [assumption].
kept:      21 succ(4,5).  [assumption].
kept:      22 succ(5,6).  [assumption].
kept:      23 succ(6,7).  [assumption].
kept:      24 succ(7,8).  [assumption].
kept:      25 succ(8,9).  [assumption].
kept:      26 succ(9,10).  [assumption].
kept:      27 step(0,22).  [assumption].
kept:      28 uses(1,r90).  [assumption].
kept:      29 uses(2,r90).  [assumption].
kept:      30 uses(3,r90).  [assumption].
kept:      31 uses(4,r90).  [assumption].
kept:      32 uses(5,r20).  [assumption].
kept:      33 uses(6,r20).  [assumption].
kept:      34 uses(7,r20).  [assumption].
kept:      35 uses(8,r20).  [assumption].
kept:      36 uses(9,r20).  [assumption].
kept:      37 uses(10,r20).  [assumption].
kept:      38 -step(x,y) | -succ(x,z) | -uses(z,u) | -connected(y,w,u) | step(z,w).  [clausify(1)].
kept:      39 -step(10,13).  [deny(2)].

============================== end of process initial clauses ========

============================== CLAUSES FOR SEARCH ====================

% Clauses after input processing:

formulas(usable).
end_of_list.

formulas(sos).
3 assign(max_weight,11).  [assumption].
4 assign(max_proofs,1).  [assumption].
5 assign(max_seconds,11).  [assumption].
6 assign(sos_limit,23).  [assumption].
7 connected(22,15,r90).  [assumption].
8 connected(15,16,r90).  [assumption].
9 connected(16,17,r90).  [assumption].
10 connected(17,18,r90).  [assumption].
11 connected(18,20,r20).  [assumption].
12 connected(20,14,r20).  [assumption].
13 connected(14,19,r20).  [assumption].
14 connected(19,21,r20).  [assumption].
15 connected(21,12,r20).  [assumption].
16 connected(12,13,r20).  [assumption].
17 succ(0,1).  [assumption].
18 succ(1,2).  [assumption].
19 succ(2,3).  [assumption].
20 succ(3,4).  [assumption].
21 succ(4,5).  [assumption].
22 succ(5,6).  [assumption].
23 succ(6,7).  [assumption].
24 succ(7,8).  [assumption].
25 succ(8,9).  [assumption].
26 succ(9,10).  [assumption].
27 step(0,22).  [assumption].
28 uses(1,r90).  [assumption].
29 uses(2,r90).  [assumption].
30 uses(3,r90).  [assumption].
31 uses(4,r90).  [assumption].
32 uses(5,r20).  [assumption].
33 uses(6,r20).  [assumption].
34 uses(7,r20).  [assumption].
35 uses(8,r20).  [assumption].
36 uses(9,r20).  [assumption].
37 uses(10,r20).  [assumption].
38 -step(x,y) | -succ(x,z) | -uses(z,u) | -connected(y,w,u) | step(z,w).  [clausify(1)].
39 -step(10,13).  [deny(2)].
end_of_list.

formulas(demodulators).
end_of_list.

============================== end of clauses for search =============

============================== SEARCH ================================

% Starting search at 0.00 seconds.

given #1 (I,wt=3): 3 assign(max_weight,11).  [assumption].

given #2 (I,wt=3): 4 assign(max_proofs,1).  [assumption].

given #3 (I,wt=3): 5 assign(max_seconds,11).  [assumption].

given #4 (I,wt=3): 6 assign(sos_limit,23).  [assumption].

given #5 (I,wt=4): 7 connected(22,15,r90).  [assumption].

given #6 (I,wt=4): 8 connected(15,16,r90).  [assumption].

given #7 (I,wt=4): 9 connected(16,17,r90).  [assumption].

given #8 (I,wt=4): 10 connected(17,18,r90).  [assumption].

given #9 (I,wt=4): 11 connected(18,20,r20).  [assumption].

given #10 (I,wt=4): 12 connected(20,14,r20).  [assumption].

given #11 (I,wt=4): 13 connected(14,19,r20).  [assumption].

given #12 (I,wt=4): 14 connected(19,21,r20).  [assumption].

given #13 (I,wt=4): 15 connected(21,12,r20).  [assumption].

given #14 (I,wt=4): 16 connected(12,13,r20).  [assumption].

given #15 (I,wt=3): 17 succ(0,1).  [assumption].

given #16 (I,wt=3): 18 succ(1,2).  [assumption].

given #17 (I,wt=3): 19 succ(2,3).  [assumption].

given #18 (I,wt=3): 20 succ(3,4).  [assumption].

given #19 (I,wt=3): 21 succ(4,5).  [assumption].

given #20 (I,wt=3): 22 succ(5,6).  [assumption].

given #21 (I,wt=3): 23 succ(6,7).  [assumption].

given #22 (I,wt=3): 24 succ(7,8).  [assumption].

given #23 (I,wt=3): 25 succ(8,9).  [assumption].

given #24 (I,wt=3): 26 succ(9,10).  [assumption].

given #25 (I,wt=3): 27 step(0,22).  [assumption].

given #26 (I,wt=3): 28 uses(1,r90).  [assumption].

given #27 (I,wt=3): 29 uses(2,r90).  [assumption].

given #28 (I,wt=3): 30 uses(3,r90).  [assumption].

given #29 (I,wt=3): 31 uses(4,r90).  [assumption].

given #30 (I,wt=3): 32 uses(5,r20).  [assumption].

given #31 (I,wt=3): 33 uses(6,r20).  [assumption].

given #32 (I,wt=3): 34 uses(7,r20).  [assumption].

given #33 (I,wt=3): 35 uses(8,r20).  [assumption].

given #34 (I,wt=3): 36 uses(9,r20).  [assumption].

given #35 (I,wt=3): 37 uses(10,r20).  [assumption].

given #36 (I,wt=16): 38 -step(x,y) | -succ(x,z) | -uses(z,u) | -connected(y,w,u) | step(z,w).  [clausify(1)].

given #37 (I,wt=3): 39 -step(10,13).  [deny(2)].

given #38 (W,wt=3): 40 step(1,15).  [hyper(38,a,27,a,b,17,a,c,28,a,d,7,a)].

given #39 (W,wt=3): 41 step(2,16).  [hyper(38,a,40,a,b,18,a,c,29,a,d,8,a)].

given #40 (W,wt=3): 42 step(3,17).  [hyper(38,a,41,a,b,19,a,c,30,a,d,9,a)].

given #41 (W,wt=3): 43 step(4,18).  [hyper(38,a,42,a,b,20,a,c,31,a,d,10,a)].

given #42 (W,wt=3): 44 step(5,20).  [hyper(38,a,43,a,b,21,a,c,32,a,d,11,a)].

given #43 (W,wt=3): 45 step(6,14).  [hyper(38,a,44,a,b,22,a,c,33,a,d,12,a)].

given #44 (W,wt=3): 46 step(7,19).  [hyper(38,a,45,a,b,23,a,c,34,a,d,13,a)].

given #45 (W,wt=3): 47 step(8,21).  [hyper(38,a,46,a,b,24,a,c,35,a,d,14,a)].

given #46 (W,wt=3): 48 step(9,12).  [hyper(38,a,47,a,b,25,a,c,36,a,d,15,a)].

============================== PROOF =================================

% Proof 1 at 0.00 (+ 0.00) seconds.
% Length of proof is 46.
% Level of proof is 12.
% Maximum clause weight is 16.000.
% Given clauses 46 (3.833 givens/level).

1 (all N all M all X all Y all R (step(N,X) & succ(N,M) & uses(M,R) & connected(X,Y,R) -> step(M,Y))) # label(non_clause).  [assumption].
2 step(10,13) # label(non_clause) # label(goal).  [goal].
7 connected(22,15,r90).  [assumption].
8 connected(15,16,r90).  [assumption].
9 connected(16,17,r90).  [assumption].
10 connected(17,18,r90).  [assumption].
11 connected(18,20,r20).  [assumption].
12 connected(20,14,r20).  [assumption].
13 connected(14,19,r20).  [assumption].
14 connected(19,21,r20).  [assumption].
15 connected(21,12,r20).  [assumption].
16 connected(12,13,r20).  [assumption].
17 succ(0,1).  [assumption].
18 succ(1,2).  [assumption].
19 succ(2,3).  [assumption].
20 succ(3,4).  [assumption].
21 succ(4,5).  [assumption].
22 succ(5,6).  [assumption].
23 succ(6,7).  [assumption].
24 succ(7,8).  [assumption].
25 succ(8,9).  [assumption].
26 succ(9,10).  [assumption].
27 step(0,22).  [assumption].
28 uses(1,r90).  [assumption].
29 uses(2,r90).  [assumption].
30 uses(3,r90).  [assumption].
31 uses(4,r90).  [assumption].
32 uses(5,r20).  [assumption].
33 uses(6,r20).  [assumption].
34 uses(7,r20).  [assumption].
35 uses(8,r20).  [assumption].
36 uses(9,r20).  [assumption].
37 uses(10,r20).  [assumption].
38 -step(x,y) | -succ(x,z) | -uses(z,u) | -connected(y,w,u) | step(z,w).  [clausify(1)].
39 -step(10,13).  [deny(2)].
40 step(1,15).  [hyper(38,a,27,a,b,17,a,c,28,a,d,7,a)].
41 step(2,16).  [hyper(38,a,40,a,b,18,a,c,29,a,d,8,a)].
42 step(3,17).  [hyper(38,a,41,a,b,19,a,c,30,a,d,9,a)].
43 step(4,18).  [hyper(38,a,42,a,b,20,a,c,31,a,d,10,a)].
44 step(5,20).  [hyper(38,a,43,a,b,21,a,c,32,a,d,11,a)].
45 step(6,14).  [hyper(38,a,44,a,b,22,a,c,33,a,d,12,a)].
46 step(7,19).  [hyper(38,a,45,a,b,23,a,c,34,a,d,13,a)].
47 step(8,21).  [hyper(38,a,46,a,b,24,a,c,35,a,d,14,a)].
48 step(9,12).  [hyper(38,a,47,a,b,25,a,c,36,a,d,15,a)].
49 step(10,13).  [hyper(38,a,48,a,b,26,a,c,37,a,d,16,a)].
50 $F.  [resolve(49,a,39,a)].

============================== end of proof ==========================

============================== STATISTICS ============================

Given=46. Generated=47. Kept=47. proofs=1.
Usable=46. Sos=0. Demods=0. Limbo=0, Disabled=37. Hints=0.
Kept_by_rule=0, Deleted_by_rule=0.
Forward_subsumed=0. Back_subsumed=0.
Sos_limit_deleted=0. Sos_displaced=0. Sos_removed=0.
New_demodulators=0 (0 lex), Back_demodulated=0. Back_unit_deleted=0.
Demod_attempts=0. Demod_rewrites=0.
Res_instance_prunes=0. Para_instance_prunes=0. Basic_paramod_prunes=0.
Nonunit_fsub_feature_tests=0. Nonunit_bsub_feature_tests=0.
Megabytes=0.10.
User_CPU=0.00, System_CPU=0.00, Wall_clock=0.

============================== end of statistics =====================

============================== end of search =========================

THEOREM PROVED

Exiting with 1 proof.

Process 59212 exit (max_proofs) Tue Dec 30 00:25:53 2025
